"species_id","group_id","behavior","domains","behavior_id","Ordr","Class"
"Apis_mellifera",700104,"E1 honey bee colonies waggle dance","foraging",119,"Hymenoptera","Insecta"
"Ateles_geoffroyi",700084,"Santa Rosa spider monkeys contact greeting","social",89,"Primates","Mammalia"
"Balaenoptera_physalus",700049,"Mediterranean fin whale subpopulation song","mating",56,"Cetacea","Mammalia"
"Balaenoptera_physalus",700059,"Northeastern North Atlantic fin whale subpopulation song","mating",66,"Cetacea","Mammalia"
"Balaenoptera_physalus",700049,"Mediterranean fin whale subpopulation song","vocal communication",56,"Cetacea","Mammalia"
"Balaenoptera_physalus",700059,"Northeastern North Atlantic fin whale subpopulation song","vocal communication",66,"Cetacea","Mammalia"
"Berardius_bairdii",700078,"Resident Commander Islands beaked whales shallow habitat foraging","foraging",84,"Cetacea","Mammalia"
"Cacicus_cela_vitellinus",700022,"Farfan cacique colony vocal dialect","vocal communication",26,"Passeriformes","Aves"
"Cacicus_cela_vitellinus",700094,"Tank Farm cacique colony vocal dialect","vocal communication",106,"Passeriformes","Aves"
"Cacicus_cela_vitellinus",700022,"Farfan cacique colony vocal dialect","mating",26,"Passeriformes","Aves"
"Cacicus_cela_vitellinus",700033,"Howard dialect caciques vocal dialect","vocal communication",39,"Passeriformes","Aves"
"Cacicus_cela_vitellinus",700094,"Tank Farm cacique colony vocal dialect","mating",106,"Passeriformes","Aves"
"Cacicus_cela_vitellinus",700033,"Howard dialect caciques vocal dialect","mating",39,"Passeriformes","Aves"
"Cacicus_cela_vitellinus",700079,"Rodman cacique colony vocal dialect","mating",85,"Passeriformes","Aves"
"Cacicus_cela_vitellinus",700079,"Rodman cacique colony vocal dialect","vocal communication",85,"Passeriformes","Aves"
"Campylorhynchus_nuchalis",700030,"Hato Masaguaral wrens WAY calling","vocal communication",36,"Passeriformes","Aves"
"Campylorhynchus_nuchalis",700030,"Hato Masaguaral wrens WAY calling","social",36,"Passeriformes","Aves"
"Cebus_capucinus",700046,"Lomas Barbudal capuchins handsniffing","social",114,"Primates","Mammalia"
"Cebus_capucinus",700046,"Lomas Barbudal capuchins toy game","play",115,"Primates","Mammalia"
"Cebus_capucinus",700046,"Lomas Barbudal capuchins handsniffing","other",114,"Primates","Mammalia"
"Cebus_capucinus",700046,"Lomas Barbudal Luehea foraging","foraging",116,"Primates","Mammalia"
"Cervus_canadensis",700071,"Pennsylvania elk group bugle calls","mating",77,"Artiodactyla","Mammalia"
"Cervus_canadensis",700009,"Colorado elk group bugle calls","mating",13,"Artiodactyla","Mammalia"
"Cervus_canadensis",700101,"Wyoming elk group bugle calls","vocal communication",113,"Artiodactyla","Mammalia"
"Cervus_canadensis",700071,"Pennsylvania elk group bugle calls","vocal communication",77,"Artiodactyla","Mammalia"
"Cervus_canadensis",700009,"Colorado elk group bugle calls","vocal communication",13,"Artiodactyla","Mammalia"
"Cervus_canadensis",700101,"Wyoming elk group bugle calls","mating",113,"Artiodactyla","Mammalia"
"Chersophilus_duponti",700017,"Ebro Valley Dupont's Lark territorial call","mating",21,"Passeriformes","Aves"
"Chersophilus_duponti",700017,"Ebro Valley Dupont's Lark territorial call","vocal communication",21,"Passeriformes","Aves"
"Chlamydera_maculata",700095,"Taunton bowerbirds bower design","mating",107,"Passeriformes","Aves"
"Chlamydera_maculata",700095,"Taunton bowerbirds bower design","architecture",107,"Passeriformes","Aves"
"Cinnyris_osea",700019,"En Gedi sunbirds song dialect","vocal communication",23,"Passeriformes","Aves"
"Cinnyris_osea",700076,"Ramat-Aviv low dialect sunbirds song dialect","mating",82,"Passeriformes","Aves"
"Cinnyris_osea",700075,"Ramat-Aviv high dialect sunbirds song dialect","vocal communication",81,"Passeriformes","Aves"
"Cinnyris_osea",700019,"En Gedi sunbirds song dialect","mating",23,"Passeriformes","Aves"
"Cinnyris_osea",700075,"Ramat-Aviv high dialect sunbirds song dialect","mating",81,"Passeriformes","Aves"
"Cinnyris_osea",700076,"Ramat-Aviv low dialect sunbirds song dialect","vocal communication",82,"Passeriformes","Aves"
"Corvus_brachyrhynchos",700099,"University of Washington crows scolding and mobbing","antipredation",111,"Passeriformes","Aves"
"Corvus_corax",700018,"EE-WW East dialect ravens vocal dialect","vocal communication",22,"Passeriformes","Aves"
"Corvus_corax",700096,"TT-QQ West dialect ravens vocal dialect","social",108,"Passeriformes","Aves"
"Corvus_corax",700096,"TT-QQ West dialect ravens vocal dialect","vocal communication",108,"Passeriformes","Aves"
"Corvus_corax",700096,"TT-QQ West dialect ravens vocal dialect","foraging",108,"Passeriformes","Aves"
"Corvus_corax",700018,"EE-WW East dialect ravens vocal dialect","social",22,"Passeriformes","Aves"
"Corvus_corax",700018,"EE-WW East dialect ravens vocal dialect","foraging",22,"Passeriformes","Aves"
"Corvus_moneduloides",700026,"Grande Terre New Caledonian crows stepped Padanus tools","foraging",31,"Passeriformes","Aves"
"Corvus_moneduloides",700026,"Grande Terre New Caledonian crows alarm calls","antipredation",32,"Passeriformes","Aves"
"Corvus_moneduloides",700026,"Grande Terre New Caledonian crows alarm calls","vocal communication",32,"Passeriformes","Aves"
"Corvus_moneduloides",700056,"New Caledonian crows wide-type Padanus tools","foraging",62,"Passeriformes","Aves"
"Corvus_moneduloides",700026,"Grande Terre New Caledonian crows narrow-type Padanus tools","foraging",30,"Passeriformes","Aves"
"Corvus_moneduloides",700056,"New Caledonian crows stick tools","foraging",63,"Passeriformes","Aves"
"Cyanistes_caeruleus",700110,"Daeli blue tits nest site choice","mating",129,"Passeriformes","Aves"
"Cyanistes_caeruleus",700115,"UK blue tits milk bottle opening","foraging",130,"Passeriformes","Aves"
"Delphinapterus_leucas",700015,"eastern Hudson Bay beluga stock migratory behavior","migration",19,"Cetacea","Mammalia"
"Eschrichtius_robustus",700068,"Pacific Coast Feeding Aggregation site fidelity","antipredation",75,"Cetacea","Mammalia"
"Eschrichtius_robustus",700068,"Pacific Coast Feeding Aggregation site fidelity","foraging",75,"Cetacea","Mammalia"
"Eschrichtius_robustus",700068,"Pacific Coast Feeding Aggregation site fidelity","vocal communication",75,"Cetacea","Mammalia"
"Falcunculus_frontatus",700100,"Wollomombi Falls shrike-tits sex-specific foraging","foraging",112,"Passeriformes","Aves"
"Falcunculus_frontatus",700002,"Armidale shrike-tits sex-specific foraging","foraging",4,"Passeriformes","Aves"
"Fringilla_coelebs",700007,"Chatham Island population songs","mating",11,"Passeriformes","Aves"
"Fringilla_coelebs",700007,"Chatham Island population songs","vocal communication",11,"Passeriformes","Aves"
"Gerygone_fusca",700080,"Rottnest Island Gerygones song type","mating",86,"Passeriformes","Aves"
"Gerygone_fusca",700080,"Rottnest Island Gerygones song type","vocal communication",86,"Passeriformes","Aves"
"Gorilla_beringei_beringei",700040,"Karisoke gorilla groups adult female grooming","social",46,"Primates","Mammalia"
"Gorilla_beringei_beringei",700005,"Bwindi Kyagurilo gorilla group teeth tree climbing","other",9,"Primates","Mammalia"
"Gorilla_gorilla_gorilla",700054,"Moukalaba Gentil gorilla group hand clapping","social",60,"Primates","Mammalia"
"Gyps_fulvus",700062,"Northern vulture population anthropic resource foraging","foraging",69,"Accipitriformes","Aves"
"Gyps_fulvus",700090,"Southern vulture population wild ungulate foraging","foraging",99,"Accipitriformes","Aves"
"Hipposideros_larvatus",700029,"Hainan caves leafnosed bats echolocation call frequency","social",35,"Chiroptera","Mammalia"
"Hipposideros_larvatus",700029,"Hainan caves leafnosed bats echolocation call frequency","vocal communication",35,"Chiroptera","Mammalia"
"Junco_hyemalis",700098,"UCSD dark-eyed juncos long-range song","mating",110,"Passeriformes","Aves"
"Junco_hyemalis",700098,"UCSD dark-eyed juncos long-range song","vocal communication",110,"Passeriformes","Aves"
"Larus_occidentalis",700000,"Alcatraz Western gulls foraging preference","foraging",2,"Charadriiformes","Aves"
"Larus_occidentalis",700000,"Alcatraz Western gulls foraging preference","mating",2,"Charadriiformes","Aves"
"Loxigilla_noctis",700008,"Colony Club site finches sugar packet opening","foraging",12,"Passeriformes","Aves"
"Loxodonta_africana",700001,"Amboseli elephant population elephant rumbles","vocal communication",3,"Proboscidea","Mammalia"
"Loxodonta_africana",700001,"Amboseli elephant population elephant rumbles","social",3,"Proboscidea","Mammalia"
"Loxodonta_africana",700081,"Samburu elephant population elephant rumbles","social",87,"Proboscidea","Mammalia"
"Loxodonta_africana",700081,"Samburu elephant population elephant rumbles","vocal communication",87,"Proboscidea","Mammalia"
"Macaca_fuscata",700106,"Koshima macaque troop sweet-potato washing","foraging",121,"Primates","Mammalia"
"Megaptera_novaeangliae",700087,"Southern Hemisphere Group V humpback whale song variants","mating",94,"Cetacea","Mammalia"
"Megaptera_novaeangliae",700028,"Gulf of Maine humpback whales lobtail feeding","foraging",34,"Cetacea","Mammalia"
"Megaptera_novaeangliae",700087,"Southern Hemisphere Group V humpback whale song variants","vocal communication",94,"Cetacea","Mammalia"
"Megaptera_novaeangliae",700058,"North Pacific humpback whale metapopulation song","mating",65,"Cetacea","Mammalia"
"Megaptera_novaeangliae",700058,"North Pacific humpback whale metapopulation song","vocal communication",65,"Cetacea","Mammalia"
"Melospiza_georgiana",700010,"Conneaut Lake swamp sparrows broken syntax songs","mating",14,"Passeriformes","Aves"
"Melospiza_georgiana",700010,"Conneaut Lake swamp sparrows broken syntax songs","vocal communication",14,"Passeriformes","Aves"
"Meriones_unguiculatus",700051,"Mongolian gerbil Family 1 vocal dialect","vocal communication",58,"Rodentia","Mammalia"
"Meriones_unguiculatus",700051,"Mongolian gerbil Family 1 vocal dialect","social",58,"Rodentia","Mammalia"
"Molothrus_ater",700011,"Convict dialect brown-headed cowbirds flight whistle dialect","vocal communication",15,"Passeriformes","Aves"
"Molothrus_ater",700044,"Lee Vining dialect brown-headed cowbirds flight whistle dialect","mating",50,"Passeriformes","Aves"
"Molothrus_ater",700044,"Lee Vining dialect brown-headed cowbirds flight whistle dialect","vocal communication",50,"Passeriformes","Aves"
"Molothrus_ater",700011,"Convict dialect brown-headed cowbirds flight whistle dialect","mating",15,"Passeriformes","Aves"
"Myiomela_major",700067,"Ooty shortwings song","vocal communication",74,"Passeriformes","Aves"
"Myiomela_major",700067,"Ooty shortwings song","mating",74,"Passeriformes","Aves"
"Orcinus_orca",700003,"Avacha acoustic clan discrete calls","social",5,"Cetacea","Mammalia"
"Orcinus_orca",700003,"Avacha acoustic clan discrete calls","vocal communication",5,"Cetacea","Mammalia"
"Orcinus_orca",700093,"T-type killer whales discrete calls","foraging",104,"Cetacea","Mammalia"
"Orcinus_orca",700088,"Southern Resident killer whales discrete calls","vocal communication",97,"Cetacea","Mammalia"
"Orcinus_orca",700074,"R-type killer whales groundfish depredation","foraging",80,"Cetacea","Mammalia"
"Orcinus_orca",700039,"K20 acoustic clan discrete calls","social",45,"Cetacea","Mammalia"
"Orcinus_orca",700088,"Southern Resident killer whales porpoise harassment","play",96,"Cetacea","Mammalia"
"Orcinus_orca",700038,"K19 acoustic clan discrete calls","vocal communication",44,"Cetacea","Mammalia"
"Orcinus_orca",700060,"Northern Resident killer whales whistles","vocal communication",67,"Cetacea","Mammalia"
"Orcinus_orca",700088,"Southern Resident killer whales whistles","vocal communication",95,"Cetacea","Mammalia"
"Orcinus_orca",700088,"Southern Resident killer whales porpoise harassment","social",96,"Cetacea","Mammalia"
"Orcinus_orca",700060,"Northern Resident killer whales whistles","social",67,"Cetacea","Mammalia"
"Orcinus_orca",700039,"K20 acoustic clan discrete calls","vocal communication",45,"Cetacea","Mammalia"
"Orcinus_orca",700038,"K19 acoustic clan discrete calls","social",44,"Cetacea","Mammalia"
"Orcinus_orca",700074,"R-type killer whales groundfish depredation","social",80,"Cetacea","Mammalia"
"Orcinus_orca",700093,"T-type killer whales whistles","foraging",105,"Cetacea","Mammalia"
"Orcinus_orca",700093,"T-type killer whales discrete calls","social",104,"Cetacea","Mammalia"
"Orcinus_orca",700088,"Southern Resident killer whales whistles","social",95,"Cetacea","Mammalia"
"Otis_tarda",700047,"Madrid great bustards migratory behavior","migration",55,"Otidiformes","Aves"
"Pampa_curvipennis",700063,"nSMO sabrewings song dialect","mating",70,"Apodiformes","Aves"
"Pampa_curvipennis",700063,"nSMO sabrewings song dialect","vocal communication",70,"Apodiformes","Aves"
"Pan_paniscus",700045,"Lomako bonobos duiker hunting","foraging",52,"Primates","Mammalia"
"Pan_paniscus",700045,"Lomako bonobos food rub","foraging",54,"Primates","Mammalia"
"Pan_paniscus",700045,"Lomako bonobos forage wade","foraging",51,"Primates","Mammalia"
"Pan_paniscus",700045,"Lomako bonobos leaf cover","architecture",53,"Primates","Mammalia"
"Pan_troglodytes",700014,"CWOT chimpanzees group 2 grooming handclasp behavior","social",18,"Primates","Mammalia"
"Pan_troglodytes",700013,"CWOT chimpanzees group 1 grooming handclasp behavior","social",17,"Primates","Mammalia"
"Pan_troglodytes_schweinfurthii",700041,"Kasekela chimpanzees termite fishing","foraging",47,"Primates","Mammalia"
"Pan_troglodytes_schweinfurthii",700108,"Mahale M-group chimpanzees rain dance","other",123,"Primates","Mammalia"
"Pan_troglodytes_schweinfurthii",700109,"Gombe chimpanzees rain dance","other",124,"Primates","Mammalia"
"Pan_troglodytes_schweinfurthii",700107,"Mahale K-group chimpanzees grooming-handclasp","social",122,"Primates","Mammalia"
"Pan_troglodytes_troglodytes",700016,"Ebo forest chimpanzees stone hammer nut-cracking","foraging",20,"Primates","Mammalia"
"Pan_troglodytes_verus",700004,"Bossou chimpanzees human snare deactivation","antipredation",8,"Primates","Mammalia"
"Pan_troglodytes_verus",700057,"North group Taï chimpanzees pant hoots","social",64,"Primates","Mammalia"
"Pan_troglodytes_verus",700004,"Bossou chimpanzees ant-dipping","foraging",7,"Primates","Mammalia"
"Pan_troglodytes_verus",700086,"South group Taï chimpanzees stone hammer nut-cracking","foraging",93,"Primates","Mammalia"
"Pan_troglodytes_verus",700057,"North group Taï chimpanzees pant hoots","vocal communication",64,"Primates","Mammalia"
"Pan_troglodytes_verus",700004,"Bossou chimpanzees pestle-pounding","foraging",6,"Primates","Mammalia"
"Pan_troglodytes_verus",700050,"Middle group Taï chimpanzees pant hoots","social",57,"Primates","Mammalia"
"Pan_troglodytes_verus",700113,"Taï chimpanzees rain dance","other",125,"Primates","Mammalia"
"Pan_troglodytes_verus",700050,"Middle group Taï chimpanzees pant hoots","vocal communication",57,"Primates","Mammalia"
"Pan_troglodytes_verus",700086,"South group Taï chimpanzees pant hoots","social",92,"Primates","Mammalia"
"Pan_troglodytes_verus",700086,"South group Taï chimpanzees pant hoots","vocal communication",92,"Primates","Mammalia"
"Parus_major",700102,"Wytham Woods great tits puzzle box foraging","foraging",117,"Passeriformes","Aves"
"Parus_major",700036,"Istállós-kői-cave foraging tits bat hunting","foraging",42,"Passeriformes","Aves"
"Parus_major",700114,"Daeli great tits nest site choice","mating",126,"Passeriformes","Aves"
"Passerculus_sandwichensis",700061,"Northern theme Savannah sparrows song dialect","migration",68,"Passeriformes","Aves"
"Passerculus_sandwichensis",700089,"Southern theme Savannah sparrows song dialect","migration",98,"Passeriformes","Aves"
"Passerculus_sandwichensis",700089,"Southern theme Savannah sparrows song dialect","mating",98,"Passeriformes","Aves"
"Passerculus_sandwichensis",700089,"Southern theme Savannah sparrows song dialect","vocal communication",98,"Passeriformes","Aves"
"Passerculus_sandwichensis",700061,"Northern theme Savannah sparrows song dialect","mating",68,"Passeriformes","Aves"
"Passerculus_sandwichensis",700061,"Northern theme Savannah sparrows song dialect","vocal communication",68,"Passeriformes","Aves"
"Passerina_cyanea",700025,"George Reserve Indigo buntings song themes","mating",29,"Passeriformes","Aves"
"Passerina_cyanea",700025,"George Reserve Indigo buntings song themes","vocal communication",29,"Passeriformes","Aves"
"Philesturnus_rufusater",700012,"Cuvier saddlebacks song dialect","vocal communication",16,"Passeriformes","Aves"
"Philesturnus_rufusater",700012,"Cuvier saddlebacks song dialect","mating",16,"Passeriformes","Aves"
"Physeter_macrocephalus",700077,"Regular clan coda dialect","social",83,"Cetacea","Mammalia"
"Physeter_macrocephalus",700027,"Gulf of Alaska sperm whales longline depradation","social",33,"Cetacea","Mammalia"
"Physeter_macrocephalus",700027,"Gulf of Alaska sperm whales longline depradation","foraging",33,"Cetacea","Mammalia"
"Physeter_macrocephalus",700072,"Plus-One clan coda dialect","social",78,"Cetacea","Mammalia"
"Physeter_macrocephalus",700077,"Regular clan coda dialect","vocal communication",83,"Cetacea","Mammalia"
"Physeter_macrocephalus",700072,"Plus-One clan coda dialect","vocal communication",78,"Cetacea","Mammalia"
"Pipistrellus_pipistrellus",700091,"Stolec (STO) pipistrelle colony echolocation dialect","vocal communication",100,"Chiroptera","Mammalia"
"Plocepasser_mahali",700105,"Kalahari sparrow weavers group PO cooperative structure building","architecture",120,"Passeriformes","Aves"
"Ploceus_bicolor_stictifrons",700032,"Hluhluwe River dialect forest weavers song dialect","mating",38,"Passeriformes","Aves"
"Ploceus_bicolor_stictifrons",700021,"False Bay dialect forest weavers song dialect","mating",25,"Passeriformes","Aves"
"Ploceus_bicolor_stictifrons",700032,"Hluhluwe River dialect forest weavers song dialect","vocal communication",38,"Passeriformes","Aves"
"Ploceus_bicolor_stictifrons",700031,"Hluhluwe Park dialect forest weavers song dialect","mating",37,"Passeriformes","Aves"
"Ploceus_bicolor_stictifrons",700021,"False Bay dialect forest weavers song dialect","vocal communication",25,"Passeriformes","Aves"
"Ploceus_bicolor_stictifrons",700031,"Hluhluwe Park dialect forest weavers song dialect","vocal communication",37,"Passeriformes","Aves"
"Poecile_atricapillus",700043,"Lee Martinez Park (LMP) black-capped chickadees gargle call","social",49,"Passeriformes","Aves"
"Poecile_atricapillus",700020,"Environmental Learning Center (ELC) black-capped chickadees gargle call","social",24,"Passeriformes","Aves"
"Poecile_atricapillus",700024,"Fort Collins chickadees dawn chorus song types","mating",28,"Passeriformes","Aves"
"Poecile_atricapillus",700020,"Environmental Learning Center (ELC) black-capped chickadees gargle call","vocal communication",24,"Passeriformes","Aves"
"Poecile_atricapillus",700055,"Mulberry/Lemay (ML) black-capped chickadees gargle call","social",61,"Passeriformes","Aves"
"Poecile_atricapillus",700043,"Lee Martinez Park (LMP) black-capped chickadees gargle call","vocal communication",49,"Passeriformes","Aves"
"Poecile_atricapillus",700055,"Mulberry/Lemay (ML) black-capped chickadees gargle call","vocal communication",61,"Passeriformes","Aves"
"Poecile_atricapillus",700024,"Fort Collins chickadees dawn chorus song types","vocal communication",28,"Passeriformes","Aves"
"Pongo_abelii",700092,"Suaq Balimbing orangutans slow loris hunting","foraging",103,"Primates","Mammalia"
"Pongo_abelii",700092,"Suaq Balimbing orangutans Neesia tool use","foraging",101,"Primates","Mammalia"
"Pongo_abelii",700092,"Suaq Balimbing orangutans bunk nesting","architecture",102,"Primates","Mammalia"
"Pongo_pygmaeus_wurmbii",700097,"Tuanan orangutans bunk nesting","architecture",109,"Primates","Mammalia"
"Pongo_pygmaeus_wurmbii",700111,"Tanjung Puting orangutans snag-riding","social",127,"Primates","Mammalia"
"Pongo_pygmaeus_wurmbii",700112,"Gunung Palung orangutans leaf kiss-squeak","vocal communication",128,"Primates","Mammalia"
"Rattus_rattus",700035,"Israeli pine cone population pinecone stripping","foraging",41,"Rodentia","Mammalia"
"Rattus_rattus",700034,"Israeli cypress population pinecone stripping","foraging",40,"Rodentia","Mammalia"
"Rhinolophus_monoceros",700023,"Formosan lesser horseshoe bats populations 1-20 echolocation call frequency","vocal communication",27,"Chiroptera","Mammalia"
"Rhinolophus_monoceros",700023,"Formosan lesser horseshoe bats populations 1-20 echolocation call frequency","social",27,"Chiroptera","Mammalia"
"Rhinolophus_pumilus",700066,"Okinawa horseshoe bats South colonies echolocation call frequency","social",73,"Chiroptera","Mammalia"
"Rhinolophus_pumilus",700065,"Okinawa horseshoe bats North colonies echolocation call frequency","social",72,"Chiroptera","Mammalia"
"Rhinolophus_pumilus",700065,"Okinawa horseshoe bats North colonies echolocation call frequency","vocal communication",72,"Chiroptera","Mammalia"
"Rhinolophus_pumilus",700066,"Okinawa horseshoe bats South colonies echolocation call frequency","vocal communication",73,"Chiroptera","Mammalia"
"Sapajus_libidinosus",700103,"Chapada dos Veadeiros capuchins stone tool nut-cracking","foraging",118,"Primates","Mammalia"
"Sapajus_libidinosus",700037,"Jurubeba group stick and stone tool use","foraging",43,"Primates","Mammalia"
"Sapajus_libidinosus",700064,"Oitenta group stick and stone tool use","foraging",71,"Primates","Mammalia"
"Sotalia_guianensis",700006,"Cananéia Estuary Guiana dolphins beach hunting","foraging",10,"Cetacea","Mammalia"
"Tursiops_aduncus",700085,"Shark Bay dolphins prey inspection","foraging",91,"Cetacea","Mammalia"
"Tursiops_aduncus",700085,"Shark Bay dolphins sponging","foraging",90,"Cetacea","Mammalia"
"Tursiops_aduncus",700053,"Moreton Bay trawler dolphins trawler foraging","foraging",59,"Cetacea","Mammalia"
"Zonotrichia_capensis",700070,"Papallacta sparrows song dialect","mating",76,"Passeriformes","Aves"
"Zonotrichia_capensis",700070,"Papallacta sparrows song dialect","vocal communication",76,"Passeriformes","Aves"
"Zonotrichia_leucophrys_nuttalli",700042,"Lake Merced dialect white-crowned sparrows song dialect","mating",48,"Passeriformes","Aves"
"Zonotrichia_leucophrys_nuttalli",700042,"Lake Merced dialect white-crowned sparrows song dialect","vocal communication",48,"Passeriformes","Aves"
"Zonotrichia_leucophrys_nuttalli",700073,"Presidio dialect white-crowned sparrows song dialect","mating",79,"Passeriformes","Aves"
"Zonotrichia_leucophrys_nuttalli",700073,"Presidio dialect white-crowned sparrows song dialect","vocal communication",79,"Passeriformes","Aves"
"Zonotrichia_leucophrys_nuttalli",700082,"San Francisco dialect white-crowned sparrows song dialect","mating",88,"Passeriformes","Aves"
"Zonotrichia_leucophrys_nuttalli",700082,"San Francisco dialect white-crowned sparrows song dialect","vocal communication",88,"Passeriformes","Aves"
